helpful,review
1,sync pop3 account problematic use wifi problem sync folder please try later interestingly actual gmail account sync fine wifi carrier account setup pop3 account tedious attempt verify data point config things far better os build email client available separate gmail
1,latest update put things back normal state thankful mastermind figure issue resolve give app star little apprehensive longevity presently work app thank lot hard work diligence
1,dear team really disappoint recent activities thats happen gmail even disable ad relate notifications keep receive unwanted irritate mail kindly help opt kind ad mail option move gmail communication
1,reason like gmail app push notifications hate use system sync battery hog matter android device use gmail push notifications hard thing believe google leave simple thing
1,ever since update ago longer suggest contact type recipient new email gmail issue add email account yahoo aol longer contact email memorize account spend endless time go old email look one contact click reply order write new email make look like reply specific email every one sync absolutely ridiculous step take order
1,open email since last month get stick load general mail system right good compose letter tap reply start write keyboard pop write anywhere write longer screen length keep scroll start see write also miss able use format ordinary gmail signature
1,unfortunately google really seem miss big picture almost exclusively use mobile devices yet much deny mobile user group email edit folders etc force use alternative
1,support external email pathetic doze email delete reappear email read may refresh unread unread count stop work need ability automatically go next email directly instead back one email access next one search function external email severely limit finally gmail need able ungroup email conversation mode need delete junk draft etc chain email annoy
1,many non stop update gmail need separate unlimited data plan new update buggy program developers remove quantity gmails folders view word gmail want view various folders view quantity number disappear forever programmer fire
1,12 17 stop queue send send 17 stop send two email reply ad top try give coupon pet store 120 miles away kid want try iphone report spam leave spam sit spam clear
1,oh google app actually work like suppose ah cheap phone think sometimes unchecks sync checkbox account need recheck edit use marshmallow phone bad yet edit need open link app still like browser need know link mail
1,latest update basically break program email longer load select google next time proper job regression test release new update
1,hate ads stop work uninstalled good riddance one person say grateful feature like space rubbish guess google way ahead game freebies ooh maybe dumb figure make remarkable unique app work would grateful would send email
1,latest upgrade break app possible type anything inside message body either reply new mail mode type allow destination subject field message header
1,disappoint recent update app browser buggy load page well take note facebook app browser never give problem
1,hard see mail search annoy perhaps know use phone would like friendly mobile interface hard make new label see button new label
1,still html cod signature ask six years https issuetracker google com issue 36929727 sync become inconsistent sometimes manually initiate sync also need account name show top bar easily know account glance please fix
1,update confuse check settings find turn conversation list stop mail group conversations least app like people hate conversations group turn set
1,earlier update mail load issue resolve update however another unique issue creep open mail read choose reply reply options cursor come hence cannot reply mail never see issue happen standards gmail appear complacency else say
1,button undo conversation view work would like see email separately lose many email put string desk top button work fine android please fix
1,biggest thing keep rat app star fact option select email extremely tedious select every single email
1,new update email open show email list click one email open show anything install previous version work perfect please fix use android
1,great app generally work well except use outlook account often delete email outlook account moments later notify email delete often happen multiple time email often go web browser outlook website delete email kinda defeat purpose use app
1,pls incorporate old gmail feature new inbox also need feature foldering email outlook express pls revert
1,better apps email absolutely anger email come main mail nope go spam promo box go hunt
1,slow fast please use encrypt combination 3072bit 4096bit rsa 384bit 512bit sha maximum security message delete server delivery thank fix update
1,numerous spam sex email unsubscribe feature despite numerous complain google nothing get fix total joke 28 spam email hours example
1,fact cannot disable conversation view standard gmail account like full web page would five star app lose count number email miss confusion inconvenience cause email app feel hide email know technically approach mean email easily miss really fit purpose google inbox similarly way group email hide clearly see full web page need see alternative far find one surely since option toggle conversation view browser also implement app without difficulty sadly many
1,every time see update check see fix errors send box still show email mean else go need show recipient long go take correct program error correct nearly email applications
1,pretty good mail client best feature need system check web version would try earlier mislead comment unavoidable conversation view push notifications turn easy control first apps settings second androids settings app pain disable notifications except play store crash one thing complain examine apps help search web answer plain ignorant
1,use gmail app check exchange mail account really fast convenient folders sync smoothly facility send group email need badly
1,app use work well previous version email show quickly well sure fast update google apps future time bug shake
1,use gmail exchange email show last conversation email show send email notification reply display
1,really share much whenever app seem ok awhile later would tell thing wrong need sign app anyone could see apps need remove name sign outgo mail need
1,open view attachments since last two update keep get duplicate email brilliant whatever break two update ago still fix latest update
1,actually like gmail know last update able view email since couple days ago please fix see one issue go back fix
1,find useful get scammed cold callers could basically use hand spinal cord damage spam account deal efficiently account useful productive much easier handle bar ever mount spam count seventy rise unerassable
1,world hat gmail conversation group feature many people say miss see email feature please make option settings feature like imap exchange email etc thank
1,love google finally mark spam outlook thank need better sync outlook keep delete email
1,go give 1star march 2017 update get frustrate decide give google team chance fix everything back normal work perfectly job
1,need delete button regular mail instead delete one time frustrate delete message get hundreds time consume delete one time fix go uninstall get another server
1,app use unnecessary permissions access private personal components unnecessarily excessively email client software app phone handle multiple account good thank google android native service google alphabet server side
1,12 years use 15gb free storage wont need delete message save space longer true despite delete email still close limit great app
1,switch multiple account convenient
1,wish update another google app give useless email cannot zoom word wrap read text
1,checkbox include remove quote text longer option switch back factory default automatically include quote text reply want text reply make reply long please fix issue immediately
1,latest update seem really unstable unreliable app load fully sometimes open mail notification tray widget use app icon mean happen go literally years issue like experience last update
1,thread initial email show see thread conversation moto open email contain reply
1,change specific font color availability right option color choose options lighter darker hue also able change font mobile would pretty useful addition please make
1,please add option select delete email please add select option delete email multi select move folder would greatly appreciate
1,email account set app every one delete amount email close app moments later get notification new unread email ones delete top load time mail drastically lag behind apps hit refresh load show load icon disappear 10 second later mail finally show sometimes show even well organize inbox folders specific email people however even though inbox clean email
1,app okay set press button delete email inbox trash can check box week 99 email delete hand take 15 minutes delete half
1,love gmail wish could access desktop version gmail browser mobile repeat mobile app version even browser need demonstrate group contact non android user account would allow access desktop version gmail
1,good lately try preview attach document picture really really really work even full 4g signal type file size sometimes click bsck try preview time eventually open
1,april 21 17 frustrate wind uninstalling update samsung pro use year old version fix horrible update break app letter capitalization begin sentence way size screen print extremely small half time reply write email allow cursor go subject compose section update work android ffs money market monopoly please fix
1,last update fuck whole app need update work fine email really suppose much
1,notifications email come slow date exchange also get new email part chain old message show notification newly receive one
1,please download entire message notify annoy blank view email initially come
1,annoy dont jesus annoy delete email
1,give star option within app delete message
1,really nice app certain function app like create label
1,everything great gmail except one thing delete unnecessary mail please add something delete unnecessary mail instead one one
1,email push time get notify email get like send email please fix
1,ever since last update get push notifications
1,please add search select bulk delete please
1,gmail truth get better app everyone loss keep good work continue grow develop ways ahead competition verizon sprint first come suck first bill 400 dollars stay gmail nice day
1,years app perfect issue however last two months least half receive email arrive inbox anywhere 12 48 hours actually send time frame confirm time stamp view detail section please repair asap cost great deal receive respond cette email time
1,application need proper style display notifications miss many important mail notify properly upgrade notification bar must able create label receive email keyword app able remind continuously see like alarm snooze hope make major problem users gmail account help see important mail important people wont miss would rate app
1,good except notifications mess work like facebook notifications instagram receive notification new post someone disappear thin air app open one notification way see except last one
1,gmail work recent update find email know send look spam folders either happen good since give products great review since must need app use google vip need gmail offer free storage google come believe many years use gmail barely use free storage worth time use along add space
1,auto sync work compose email always stick outbox queue notification pull check incoming email please insult intelligence everything clear cache check sync gmail update remove account uninstall reboot airplane power save everything everything use android happen yahoo mail love yahoo mail
1,great mail app need advertise spend 800 phone expect see advertise stock email app also please support rich text signatures image signatures days send mobile device excuse go could also dark theme easier eye thank
1,gmail recently remove way contact even though get step cod send phone recovery email email still cannot gain access second gmail way reach warn lose access email anytime process regain
1,please explain world email app need access body sensors flip absurd pop every second tell work right unless google play access every damn thing phone make consider change email providers
1,inbox label show unread email show force stop app restart get work also something seriously wrong sync microsoft account take forever email sync end remove account app
1,glitches spare wonderful app image append footer wont load app use desktop version signature mobile app far annoy glitches app request developers urgently take care get star
1,miss important email app decide give notification say later deadline piss right reason set email phone get notification soon get email days later
1,theme even dark mode ability create edit view rule create calendar events message badge notifications icon bare bone would cease exist think own app platform would result world class app instead meh
1,ffs add animate gifs app even work properly problems notifications huge number users experience completely ignore several months listen feedback users absolutely way contact anyone responsible app sick unaccountability
1,app terrible hotmail tie problem poster delete email come right back delete come right back report email spam come right back log hotmail computer report spam stop come pain ass please something suggest fix
1,delete message yahoo inbox keep appear gmail show new mail unless open app refresh screen keep jump cursor need scroll really inconvenient
1,work fine part one thing bug archive email search example search email contain label inbox try archive message search result find option surprise frustrate basic feature seem present
1,awesome app easy learn first time use really easy use layout simple sophisticate separate email folders able detect spam email archive ur email save forever save upto 15gbs worth email multiple account even non google account think excellent
1,work great work every single time open soon click link email switch another app get unfortunately gmail crash formatter many time uninstall clear phone memory update gmail get message every single time extremely frustrate
1,love gmail google products reason least pixel xl gmail app 100 unusable crash without exaggeration every thirty second least try every fix every forum update app nothing work one help even write full sentence email without get kick infuriate bug ever deal want rip every one hair root please please please fix least star app
1,seem actually delete unwanted mail delete items magically reappear second later gmail giant exercise frustration users feature poor poorly implement extremely cranky use
1,advertise spammed like crazy busy many categories stand garbage mail sell personal info enough send constant advertise try microsoft inbox spam quiet clean multiple account option create new folder line help tell go computer want android
1,mark gmail send email spam gmail responsible send spam message new mail notification alert stop every fresh update app become worse bloat size memory utilization move app external memory card occupy lot scarce space memory mobile phone
1,tire delete email individually get new s8 set app reload 600 email already delete old phone know google could fix easily understand technology make things efficient delete laptops one time complete time waster thank google sure hear plenty listen
1,app evolve good pace still miss basic must feature create group favorite contact simply add contact group name add person one one feature desktop browser gmail interface app please add soon
1,thing like gmail app lack functionality like desktop version example select conversations one one delete app desktop version simply select delete everything one go wait feature years give full five star feature incorporate
1,new layout message get confuse anyone talk loose track email go back straightforward fold last email etc even think email instead reply
1,app great stop send message outgo message would become stick outbox even update app clear data still issue unfortunately cannot recommend app try different app bug fix
1,unstable work constant app restart slow operation sometimes mail go send say queue stay way 10mins note high wifi phone also relatively fast
1,app constantly nag deny permissions want feature get google app slow wifi view email device load new email
1,like find irritate ads continually mark inappropriate personal still appear date credit card point ask dismiss ad take notice otherwise good app
1,main issue app deletion email delete email notification app swipe email never get delete fact get notify new email arrive wait attention use email clients face problem
1,ever since last samsung update galaxy s7 edge longer receive notifications email check settings everything correct sadden important email receive unaware notifications come
1,thing far opinion best mail app platforms however mobile app version suffer one major deficiency delete button simple featuer google implement long ago delete block mail one one unacceptable day age google please fix
1,need work optimize 10 inch screen third party email account work properly delete email magically reappear inbox lot quite disappoint
1,update change star seem full use gmail last update 04 19 seem solve state issue star rat use love gmail app since last update 31 open read 99 email android phone one instance open reply super aggravate spend lot time away computer need ability answer message phone
1,great recently need permission control body sensors make sense nothing complete application function moreover need pop evrytime try send email ask something even dont mention user infringement one type fitness thing
1,new version disable auto sync account either account set auto sync disable option select good could please revert feature also sync email contact phone contact option block please revert feature well day day app get useless
1,receive email unless keep refresh 100 time problem email would come straight send sure work also send email say qued go outbox
1,gmail general hugely lack functionality let alone intuitive functionality simple things like add group contact receive email contact gmail lack sort ability simply copy paste group address contact add absolutely unthinkable cannot get functionality together
1,severe notifications sync issue email notification doesnt go away open read notifications almost never show latest update get worse use good work lately issue still fix latest update
1,every update bring misery spend time tick every item delete nothing happen delete button hit search items ridiculous either locate item could month two ago see message years go star flag expect able see within specific folder time end go online rather use app unfortunately
1,could receive letter send pigeon app load email slow pointless cannot uninstall disappoint begin cover app joke
1,able receive email since last week tie recent update receive email need sort matter urgency
1,best official problem face show process many time data remain send whatsapp send bunch pdf gmail conclude time remain get idea send show send outbox send give information send hope shall understand little bug shall clear
1,new version good except spam folder option top empty spam want scroll check message make sure spam delete scroll back empty folder
1,unable open email send click email direct original email send sure reply email open
1,like anyone else sort mail unless request inconvenience delete one time instead check group delete like apps limit feature time consume
1,weaken security privacy
0,child design
0,way disable remote image
0,need support multi task
0,meet requirements
0,great app
0,best
0,awesome email app
0,love gmail
0,work great iphones
0,daily email app
0,always love gmail
0,great app
0,stand change design
0,new feature confuse
0,great mail client best email service
0,convenient
0,solid
0,excellent
0,gmail ios star app
0,love app
0,gmail awesome
0,star
0,best
0,email
0,nice
0,app awesome
0,work well
0,love
0,great user face nice graphics
0,switch thunderbird
0,amaze email
0,love
0,best best
0,great work
0,love
0,hate new layout
0,best
0,previous versions better
0,great easy
0,amaze
0,user friendly
0,efficient app wanna use china
0,awesome app convenient
0,great app
0,awesome
0,google feed gmail
0,great
0,simple awesome
0,support multiple account
0,love
0,always work
0,great app
0,great
0,happy
0,best
0,awesome
0,primary email past 10 years
0,must gmail users
0,best
0,think pretty great
0,great use
0,love
0,help
0,learn
0,easy peasy
0,excellent app
0,killer
0,great app
0,love
0,nice
0,love
1,love use gmail many productivity options integrate make use email efficient course productive
1,please bring delete button bottom page like apple mail app hard delete email use one hand time try reach top page iphone plus also little space button would great avoid press different button
0,easy use iphone
1,give still minor feature like see perhaps completely use could
1,love ability create soooo many personalize folders connect google apps contact interaction much
1,recommend anyone work google products apps
1,gmail weaken security privacy auto load remote image longer give way turn
1,use honor set disable spammers know tap email begin send spam hack attempt also marketers want know read email know without consent thank new app update
1,back use regular mail app iphone work better gmail least weaken privacy security like gmail
1,new design look like child design unprofessional cartoonish integration corporate logos obnoxious swing miss google
0,google
0,ipad pro hate calendar side side gmail love everything app
0,nothing app email apps great
0,close perfect
0,best mail app planet anything one need something complain
0,way better apples original version organize account email promotions scam etc
0,fast efficient easy app best come
0,everything need
0,easy use navigate
0,use check email google voice
0,love great search
0,wish email group work
0,easy convenient work thy update constantly allow space send bigger file perfect
0,good google service ios
0,email everything
1,user friendly less feature see improvement actually go backwards imho delete email unless open really difficult find control well google best effort
1,still try learn feature app far work okay overly thrill app concern security issue auto open image mention previous comment part lack thrill might due know feature settings continue explore
0,excellent
1,small font size use body copy gmail email app ruin vision try use
1,simple cut paste email content app clipboard unacceptable
1,flag email app follow
1,hell go governance google years since app first publish issue still address really unacceptable yahoo google
1,like use gmail app save time sign every time want check email
1,know apps go change basis strong solid good app email see good email apps besides come phone use something less comfortable like hotmail yahoo
0,thank
1,gmail ios fantastic experience smooth design well easy navigate integrate well ios use native email app iphone since come
0,gmail best mail client
0,love app well organize quick smooth nice design need mail cilent one place
0,love
0,thank make business easier
0,great
0,much better mail application phone
0,great app
0,get mail
0,get email matter
0,work well
0,love chrome gmail
0,gmail user since inception far best
0,love easy use
0,gmail user several years desktop laptop mobile version fine quick full feature
0,switch gmail client thunderbird simply work better responsive things wish work differently sure minor app generally work way expect thank google
0,cant live without
0,love everything
0,gmail best best mail far kudos
0,thank gmail rock
0,every get two notifications one email
1,much graphics enough functionality colorful bits take valuable screen real estate iphone make hard read reply email
0,best email app
1,unless miss ability select multiple email action delete seem anymore make tedious delete unwanted email one one
0,comfortable easy
0,best app ever communicate love best
0,easy use make life easier
1,wanna use google apps china
1,still aol account much easier use gmail older generation gmail frustrate use kid set use work
1,love love everything format reliability
1,great interface love separate spam everything else
1,good read email horrible look respond type email type randomly jump different portion email
0,could use label
0,good app like years use mobile
0,great app fit travel need anytime
1,latest update google screw ability print
0,please fix
0,upset
0,folder save items print access laptop print
0,might well use paper pencil
0,easy convenient sophisticate yet complicate
0,good
0,comfortable use look good
0,get email account centralize one app
0,way better iphone mail app
0,simple nice app use email greatly appreciate thank google
0,work great iphone ios
0,great
0,content gmail
0,best
0,best yet
0,far gmail offer best free email service love spam find separate automatically love edit options really great email service overall
0,like app happy use time
0,great app work perfectly
0,use email
0,love able type letter easy find person try send email attachments easy
0,good email application power user like work really well matter platform open sync across issue
0,get email keep use gmail perfect
0,help keep track google email iphone
0,still lot learn
0,seamless easy use
